{
  "schemaVersion": "1.0",
  "runId": "2026-08-06T00-22-16-197Z-eb32ee0d",
  "surface": "Panel accessibility verification process",
  "findings": [
    {
      "id": "F-001",
      "severity": "P0",
      "confidence": "observed",
      "surface": "SHIPPABLE UI verification",
      "problem": "Panel can pass a focus-visible state without proving that focused components remain visible around sticky or persistent author-created content.",
      "evidence": [{"type": "file", "ref": "cli/validate.js", "claim": "The previous required-state list contained focus_visible but no focus-obstruction state."}],
      "change": "Require and validate a distinct WCAG 2.4.11 focus_not_obscured result with a rendered keyboard-test procedure.",
      "personaImpact": {"priority": "help - keyboard users can track their current interaction point", "secondary": "help - teams receive a concrete AA release check"},
      "acceptanceCheck": "A SHIPPABLE run without focus_not_obscured pass or justified n/a fails validation.",
      "owner": "Implementation Verifier",
      "sourceArtifacts": ["panel-report/council.md", "panel-report/verification.md"],
      "status": "verified"
    }
  ]
}
